Column1;Date;Headline;Text;Category
596;27/08/2021;HP Inc. and Dell Stock Look Attractive and Cheap. Here’s Why.;"HP Inc. and Dell Stock Look Attractive and Cheap. Here’s Why.. One peculiar outcome of the pandemic has been a newfound appreciation for the personal computer. The humble PC had been out of the spotlight for years. Eclipsed by the rise of smartphones, the PC had become a stale, dull, largely underappreciated appliance—technology’s toaster. In 2019, when unit sales inched up just 2.7%, that actually was good news for the industry, because it was the first year of global unit growth since 2011. But last year, with schools, offices, retail stores, and most everything else shut down by Covid-19, the lowly PC became a lifeline, a means to stay in touch and keep working. However, the average American household had barely more than one computer, which didn’t cut it for the typical family of four. The pandemic also underlined the need to upgrade to hardware capable of running videoconferencing and other essential software. Result: a personal computer boom. Sales rose 13.1% in 2020, says International Data Group, with a 14.2% jump expected for 2021.This revival has boosted the fortunes of Apple (ticker: AAPL), Dell Technologies (DELL), and HP Inc. (HPQ). Earlier this year, demand jumped into ludicrous mode: In its March quarter, Apple posted 70% growth in Mac sales. In their April quarters, consumer PC sales rocketed upward by 72% at HP and 42% at Dell.But booms don’t last forever, and this one is showing signs of aging. In Apple’s June quarter, Mac sales were up 16%—still impressive, but a clear deceleration. The PC peripherals company Logitech International (LOGI), which had a 66% sales jump in its June quarter, cautioned that its top line would be flattish for its March 2022 fiscal year.That was all prelude to Thursday’s June-quarter earnings reports from Dell and HP. Investors were jittery heading into the announcements. For one thing, while the Delta variant might be muting the economic recovery, most schools are operating in person, and some businesses are beginning to return to the office. In addition, thesemiconductor component shortage is crimping growth at hardware companies, big and small. As it turned out, there were good reasons to be nervous.HP’s quarter was a bit of a stinker, though the company asserts that the issues were about supply, not demand. While profits handily beat guidance, thanks in part to some one-time gains, revenue, at $15.3 billion, missed the Street consensus by $600 million.HP CEO Enrique Lores tells Barron’s that the company could have shipped more products if it had more parts, in particular cheap, low-end integrated circuits like microcontrollers. Lores says HP exited the quarter with a backlog equal to a full quarter of sales—the most ever. “We are selling everything we can produce,” he says.Still, the numbers disappointed investors. Consumer PC revenue rose just 3%; commercial PC revenue was off 1%. At least in part, the latter reflected soft Chromebook sales, as schools slowed purchases. Lores is bullish on a rebound in enterprise demand as offices reopen. He sees Chromebook sales recovering by quarter end or shortly after, and consumer purchases being boosted by the coming rollout of Windows 11, the latest version of Microsoft’s flagship operating system. But the parts issue is clouding the picture and probably will remain an overhang on the stock, at least for now. That’s particularly true, given Dell’s results. Dell’s sales growth accelerated to 15% in the latest quarter, versus 12% in the previous one. That was its best quarterly gain since 2018. At Dell’s PC-centric Client Solutions Group, revenue rose 27%, up from 20%, with gains of 17% from consumers and 32% from commercial customers. In an interview, Dell CFO Tom Sweet said that both PC and enterprise hardware sales would have been even higher with better component availability. Like Lores, he sees the problem lingering into 2022. Sweet notes that Dell has kept margins flat, in part by ratcheting up prices to offset higher costs. Dell also seems to be managing its supply chain better than HP. And it’s clearly taking market share.Still, Dell ’s enterprise hardware business came in a little light, and storage demand overall remains flat; the enterprise spending boom isn’t quite here yet. For the stock, the bigger issue was that results from VMware (VMW) disappointed the Street. Over half of Dell’s market cap reflects its 81% VMware stake, which it will spin off to Dell shareholders in early November. VMware’s earnings met expectations at the top line, but the business mix underwhelmed investors, who want a faster shift to the cloud. That said, both HP and Dell should get a boost from an expected pickup in IT spending, and both stocks look cheap. HP bought back $1.5 billion of shares in the quarter, and Lores argues that it’s undervalued, with more buybacks coming. As for Dell, it will use the proceeds from a special dividend that VMware will issue to holders, right before the spinoff, to pay down more than $10 billion in debt, a move that should spur ratings agencies to upgrade Dell’s credit to investment grade. And while the air might slowly be coming out of the personal computer boom, the risks for both stocks look modest. HP trades for about eight times expected fiscal 2022 profits. Dell is nearly as cheap, and merits a fresh look when the dust settles on the VMware spinoff. Buy them both. And maybe a new PC, too; it could be time. Write to Eric J. Savitz at eric.savitz@barrons.com";5
83;14/12/2021;Apple Stock Gets an Upgrade on Potential for AR/VR Headsets;Apple Stock Gets an Upgrade on Potential for AR/VR Headsets. Apple received some new love from Wall Street as analysts continue to ratchet up their expectations for the stock to factor in the potential for the company’s so-far unannounced entry into the market for augmented- and virtual-reality hardware.As noted in the most recent Barron’s Tech Trader column, analysts have begun revising their target prices and earnings models for Apple (ticker: AAPL) shares to reflect the anticipated debut of the company’s AR/VR headset, or glasses, or whatever the product turns out to be, about a year from now. On Monday, J.P. Morgan analyst Samik Chatterjee raised his target for the stock price to $210, from $180. That compares with the share price of a bit more than $174 Tuesday morning.Chatterjee declared Apple stock his top pick for 2022, joining Wedbush analyst Dan Ives, who recently said the same. Evercore ISI analyst Amit Daryanani on Tuesday said the shares are among his favorite choices for 2022.BofA Global Research analyst Wamsi Mohan raised his rating on Apple shares to Buy from Neutral, while boosting his target on the stock to $210, from $160. He cited the expected arrival of an AR/VR headset in making the call. “We view this technology as a game-changer as it will enable many new applications which will require high performance hardware and higher access speeds,” he wrote in a Tuesday research note.While some analysts worry that AR/VR glasses could eventually replace the iPhone as a primary connectivity device, Mohan said that he thinks iPhone sales in fiscal 2023 sales will be better than some expect. Augmented reality could become “the killer app” for 5G devices, while the AR/VR category offers new opportunities for Apple’s services business, he said.Mohan thinks Apple will continue to aggressively return capital to holders, and also noted that many institutional investors remain underweight Apple relative to the S&P 500. They could boost their positions ahead of the AR/VR launch next year, he said. Daryanani, the Evercore ISI analyst who named Apple as a top pick for 2022, repeated his Outperform rating and boosted his target price on the stock to $200, from $180. In a research note, Daryanani said he thinks Apple can sustain growth in earnings per share in the mid teens, “driven by a host of secular levers,” in particular growth in both wearables and services. He said Apple’s services arm can reach $100 billion in revenue by fiscal 2025, and that he sees a path for wearables to become a $75 billion business.Daryanani’s other top picks for next year include the connector company Amphenol (APH), networking companies Arista Networks (ANET), Cisco Systems (CSCO) and Ciena (CIEN), and the IT services provider CDW (CDW).After a recent surge of nearly 20% that took the company’s market capitalization close to $3 trillion—a milestone no other public company has ever reached— Apple shares have succumbed to some modest profit taking. Tuesday morning, the stock was down 0.7%, on a day when the Nasdaq Composite was off 1.2%. At $174.38, the stock is less than a 5% rally away from the $3 trillion mark.Write to Eric J. Savitz at eric.savitz@barrons.com;5
37;06/12/2021;Morgan Stanley boosts ratings on banks ahead of expected interest rate hikes;Morgan Stanley boosts ratings on banks ahead of expected interest rate hikes. Morgan Stanley on Monday boosted ratings on two banks and issued bullish comments on others, saying the sector was the most likely to outperform when interest rates rise.While jitters around the omicron variant have pushed bank stock prices down in recent sessions, Morgan Stanley analyst Betsy Graseck advised clients to “buy the dip” in bank stocks.“We’ve seen this movie before,” Graseck said. “Virus hits, scientists create vaccine to address virus. If omicron needs a new vaccine, Pfizer and Moderna say it is 1Q production, 2Q distribution. At worst, from an economic perspective only, we think this drives one quarter of slower growth, with no lockdowns in the U.S.”She said banks have outperformed the S&P 500 SPX more than any other sector during periods of rising rates. They’re also the only sector that outperforms during periods of rising real yields. Roughly, a 25 basis point interest rake hike by the Fed will add about 1.5% to earnings per share to banks, she said.And recent indications from the Fed suggest more than one quarter-point rate hike may be expected in 2022. Read more about rate expectations in MarketWatch’s “The Fed” column.The SPDR S&P Bank exchange-traded fund KBE was up 3.1% in morning trading Monday. The ETF has lost 4.3% over the past months, while the S&P 500 has slipped 2.6%.Graseck highlighted as top plays six stocks: Ally Financial Inc. ALLY, Alliance Data Systems Corp. ADS, Capital One Financial Corp. COF, Regions Financial Corp., RF, State Street Corp. STT, Synchrony Financial SYF and Wells Fargo & Co. WFC. She upgraded Wells Fargo to equal-weight from underweight, with a $61 price target, and boosted its view on Goldman Sachs Group Inc. GS to equal-weight from underweight with a price target of $479. Meanwhile, Graseck trimmed her rating on Citigroup Inc. C to equal-weight from overweight, with a price target of $82, on a lack of catalysts for the stock. She also cut Bank of New York Mellon Corp. BK to equal-weight with a price target of $59, on valuation and low loan exposure, and PNC Financial Services Group Inc. PNC to underweight from equal-weight, with a price target of $209.For the omicron bounceback, Morgan Stanley favors Synchrony Financial and Capital One, because they’re trading close to their price-to-earnings ratio lows, just as loan growth is expected to take off, she said.For rate hikes, the “clear winners” are Wells Fargo and State Street, “given their rate sensitivities and attractive valuation.” She sees potential share price upside of 28% for Wells Fargo and 42% upside for State Street.For commercial loan growth, Morgan Stanley spotlighted Regions Financial, which has a big exposure to commercial and industrial lending.“While significant risks around the timing of asset cap removal and further regulatory action remain, probability of higher rates sooner skews the risk-reward more favorably,” Graseck said about Wells Fargo.Shares of Wells Fargo jumped 4% on Monday. The stock is up 65% this year, compared with a gain of 22.1% by the S&P 500. In other Monday trades, Goldman Sachs rose 2.5% and Citigroup rose 0.7% and BNY Mellon added 1.5% and PNC advanced by 1.7%.;5
561;15/09/2020;Citi to resume layoffs after pause during pandemic: reports;Citi to resume layoffs after pause during pandemic: reports. Citi C, +0.53% is going to resume job cuts after a pause during the pandemic, according to reports from Bloomberg News and Financial Times citing a statement. The Citi job cuts will amount to less than 1% of its workforce, which totaled 204,000 at the end of June. Citi said its overall staff levels would be stable due to recent hiring.;6
663;06/08/2021;Big Tech is suffering from a ‘Great Resignation’ of workers, who say ‘It’s a good time to leave’;"Big Tech is suffering from a ‘Great Resignation’ of workers, who say ‘It’s a good time to leave’. A confluence of factors have led the rank and file at Big Tech companies to leave what were coveted jobs a decade ago for the potential riches of startups and young public companies, with some participants calling it the “Great Resignation.”In much the same way that Apple Inc. AAPL, -0.25%, Google parent Alphabet Inc. GOOGL, +0.05% GOOG, +0.19%, Amazon.com Inc. AMZN, -1.06%, Facebook Inc. FB, -0.06%, and others lured workers from mature and seemingly staid tech giants like International Business Machines Corp. IBM, +2.44% a decade ago, a new generation of upstarts flush with cash from venture capitalists and Wall Street is aiming for their employees. More than a dozen Big Tech defectors recently contacted by MarketWatch said they were wooed by a potential for an initial public offering, the chance to make a splash at a smaller company, and the opportunity to escape the stigma of working at some of tech’s biggest names.“There has been a burst of activity [of people leaving]. If anything, the pandemic delayed decisions,” says Raymond Endres, chief technology officer at Airtable, a low-code app-building platform he joined in mid-May after a decade at Facebook, most recently as vice president of engineering for Facebook Messenger.“It is a good time to leave. There’s a lot of funding, competition and great opportunities,” Endres said.Some employees who recently left Big Tech are calling it the “Great Resignation,” and they blame COVID-19-related job burnout, which could also be a widespread problem — Microsoft Corp. MSFT, -0.43% research found 41% of the global workforce is weighing leaving their current employer this year. In tech specifically, about one-third of more than 2,800 information-technology professionals said they plan to look for a new job in the next few months, according to a recent Robert Half International survey, while employers posted more than 365,000 IT job openings in June, the highest monthly total since September 2019, according to trade group CompTIA.A confluence of factors have led to “a Big Tech sojourn,” Columbia Business School professor Adam Galinsky told MarketWatch. Workers at major tech employers are considering a jump to smaller companies because of pandemic burnout that has forced many to re-evaluate their jobs and seek more control; resistance to being forced to go to the office on a big campus at least twice a week; and frustrations at working within vast bureaucracies where change is glacial and outside criticism is fierce.Opinion: Some tech workers are leaving San Francisco. They won’t be missedRan Mokady left Amazon, where he was general manager of an Alexa division, to become chief product officer at Intuition Robotics, a startup working in AI and robotics for older adults.“I was attracted to the mission; getting up in the morning and making people’s lives better,” Mokady told MarketWatch. “The pandemic caused me to re-evaluate things, after sitting at home for a year.”A white-hot tech IPO market — there have been 84 offerings so far in the U.S. this year at $50.4 billion, compared with 65 in 2020 for $38.7 billion, according to Dealogic — has would-be employees lining up to make money, and an impact, in short order. In July alone, there were at least 30.“There’s lot of [IPO] money out there,” says Kelly Soderlund, who decamped from software giant SAP SAP, -0.69% in December 2020 to join TripActions, a travel-management company. “Employees have never been in such a position of power. It’s an interesting inflection point within the market.”Read: The 20 best-performing IPOs of the past three years have returned up to 1,477%VC money is also at record highs. This year is on track to be venture’s “best year yet,” according to PitchBook. Through June, $150 billion has been raised among about 7,000 deals, ahead of last year’s record total of $164.3 billion in 12,362 deals. Nearly 200 megadeals at or exceeding $100 million closed in the second quarter, bringing this year’s total to $85.5 billion across 385 such deals.Renchu Song, engineering manager at TigerGraph, left for Facebook last year but quickly returned. “Working at a startup, you have more connection with employees, and things move faster,” Song told MarketWatch. TigerGraph, which has also hired ex-Googlers, plans to increase its workforce this year to about 300 from 90.Apple, Amazon, Facebook, and Google representatives did not respond to emails seeking comment. Microsoft referred to its aforementioned survey of the workplace.Sometimes, workers come in clusters from another company. Consider Nestlé NESN, +0.08% subsidiary Freshly. Six executives — including its chief commercialization officer, senior vice president of brand and partnerships, and executive innovation chef — have come from Amazon since January. “I thought I would be a lifer at Amazon,” Freshly Chief Commercialization Officer Anna Fabrega told MarketWatch, commenting on her 10 years at the e-commerce giant. “But this was a tremendous opportunity. I can have a far greater impact and more influence on the company’s trajectory, which quite frankly was harder at Amazon.”Don’t miss: How long will the Silicon Valley employees who can’t work from home keep getting paid?Many mentioned the chance to have an impact at a smaller company, after years of massive growth at Big Tech companies. In November, Pat McQueen left Salesforce.com Inc. CRM, -2.31% after 17 years to lead operations and sales engineering at Copado, a startup in the developer tools market. “I have a chance to build strategy at Copado, and not implement someone else’s strategy,” McQueen told MarketWatch. “And I think Copado is on a path to being the next unicorn. It’s pretty exciting.”";6
1109;22/10/2015;3M to cut 1,500 jobs in restructuring;3M to cut 1,500 jobs in restructuring. 3M Co. unveiled a restructuring plan that includes an expected workforce reduction of roughly 1,500 positions globally as the diversified manufacturer reported that its third-quarter earnings were nearly flat and currency impacts weighed on revenue.The St. Paul, Minn.-based company expects a fourth-quarter charge of 13 cents a share related to the restructuring program. The program will be focused on reducing overhead costs, largely in the U.S. as well as slower-growing markets, particularly its Europe/Middle East and Africa business and Latin America. 3M has a global workforce of roughly 90,000 employees.The company also anticipates pretax cost savings of $130 million for next year.3M has been working to tidy up its vast portfolio of products, which include Scotch tape, kitchen sponges and materials used in making computer screens. Meanwhile, 3M continues to add more products through acquisitions and new combinations of its core technologies in such areas as films, adhesives and coatings.3M recently announced the sales of a provider of automated checkout systems for libraries and a French maker of license plates and highway signs. Earlier this year, 3M paid $1.8 billion for Capital Safety, a maker of harnesses and other items designed to protect workers.In addition to watching for any signs that the portfolio changes are boosting sales, investors also were expected to be on the lookout during the conference call for signs of how weaker demand for computers, smartphones and tablets is affecting the outlook for 3M's materials that are used in semiconductors and other electronic components.For the latest quarter, electronics and energy-segment sales, excluding currency, fell 2.8%.Overall, 3M reported a profit of $1.3 billion, or $2.05 a share, essentially flat from a year earlier, when the company earned $1.98 on a per-share basis. The company's share count was lower in the most recent quarter.Revenue decreased 5.2% to $7.71 billion. Organic sales, excluding currency effects, rose 1.2%, compared with the company's long-run target for 4% to 6% annual growth in organic sales.Analysts polled by Thomson Reuters expected per-share profit of $2 and revenue of $7.85 billion.Operating margin rose to 24.3% from 23.4%.3M also adjusted its full year per-share earnings guidance, and now expects $7.73 to $7.78, compared with its previous view for per-share profit of $7.73 to $7.93.Write to Tess Stynes at tess.stynes@wsj.comSubscribe to WSJ: http://online.wsj.com?mod=djnwires;6
717;22/05/2018;BP to cut 540 jobs from upstream workforce;BP to cut 540 jobs from upstream workforce. BP PLC (BP.LN) said on Tuesday that it will cut its global upstream workforce by approximately 3%, resulting in around 540 job losses, as it aims to improve the business's efficiency and competitiveness.The oil-and-gas giant said that it was making the cuts to its 18,000-strong workforce in its upstream business, which deals with the production of crude oil and natural gas, as part of a continuing process to modernize the company.BP said in a statement that it continued to focus on the efficiency of its capital spend to maintain competitiveness, adding that it remains committed to developing upstream opportunities and delivering its five-year growth plan.;6
367;03/12/2020;Post-it maker 3M to cut 2,900 jobs globally in new restructuring;"Post-it maker 3M to cut 2,900 jobs globally in new restructuring. 3M Co. MMM, +1.10% said Thursday it is planning a restructuring that will impact 2,900 jobs globally as the Post-it maker and diversified industrial company moves to align operations with the changing economy in the face of the coronavirus pandemic. ""The COVID-19 pandemic has advanced the pace of change and disrupted end markets around the world, increasing the need for companies to adapt faster,"" said Mike Roman, 3M chairman and chief executive officer in a statement. 3M already introduced a new global operating model in January, and is now aiming to better use analytics to drive efficiencies. The company is expecting to book pretax charges of $250 million to $300 million, of which $120 million to $150 million will be booked in the fourth quarter. The company expects to generate annual pretax savings of $200 million to $250 million, with $75 million to $100 million expected in 2021. Shares were down 0.1% premarket and have fallen 1.6% in the year to date, while the Dow Jones Industrial Average DJIA, -0.01% has gained 4.7% and the S&P 500 SPX, -0.41% has gained 13.6%.";6
133;20/09/2021;Lightsource BP Secures $1.8 Bln Credit Facility, Targets 25GW Solar Developments by 2025;"Lightsource BP Secures $1.8 Bln Credit Facility, Targets 25GW Solar Developments by 2025. By Jaime Llinares TaboadaBP PLC's Lightsource bp said Monday that it has secured a $1.8 billion credit facility to develop 25 gigawatts of solar power generation capacity by 2025.The solar energy company, which is 50% owned by BP, said the credit and trade finance facility was provided by ten financial institutions and underpins its growth ambitions and execution strategy.The company said that it is now targeting 25 gigawatts of developed projects--fully permitted, with construction ready to begin--by 2025. Lightsource has developed 3.8 gigawatts globally since its formation in 2010.Lightsource said its pipeline continues to grow rapidly, and it expects to create 500 new jobs over the next four years.""Lightsource bp has developed more than 30 projects, which today have consistently delivered 8% to 10% returns. So when people ask if we really have the capability to deliver the returns we talk about, the answer couldn't be clearer--yes, we can because we are,"" Dev Sanyal, BP's executive vice president of gas and low carbon, said.Write to Jaime Llinares Taboada at jaime.llinares@wsj.com; @JaimeLlinaresT";7
