Column1;Date;Headline;Text;Category
466;27/09/2021;Chinese factories grapple with power cuts;Chinese factories grapple with power cuts. BEIJING (AP) — Global shoppers face possible shortages of smartphones and other goods ahead of Christmas after power cuts to meet government energy use targets forced Chinese factories to shut down and left some households in the dark.In the northeastern city of Liaoyang, 23 people were hospitalized with gas poisoning after ventilation in a metal casting factory was shut off following a power outage, according to state broadcaster CCTV. No deaths were reported.A components supplier for Apple Inc.’s AAPL, -0.20% iPhones said it suspended production at a factory west of Shanghai under orders from local authorities.The disruption to China’s vast manufacturing industries during one of their busiest seasons reflects the ruling Communist Party’s struggle to balance economic growth with efforts to rein in pollution and emissions of climate-changing gases.“Beijing’s unprecedented resolve in enforcing energy consumption limits could result in long-term benefits, but the short-term economic costs are substantial,” Nomura economists Ting Lu, Lisheng Wang and Jing Wang said in a report Monday.They cut their economic growth forecast for China to 4.7% from 5.1% over a year earlier in the current quarter. They cut their outlook for annual growth to 7.7% from 8.2%.Global financial markets already were on edge about the possible collapse of one of China’s biggest real estate developers, Evergrande Group 3333, +1.26%, which is struggling to avoid a default on billions of dollars of debt.Manufacturers already are facing shortages of processor chips, disruptions in shipping and other lingering effects of the global shutdown of travel and trade to fight the coronavirus pandemic.Residents of China’s northeast, where autumn temperatures are falling, report power cuts and have appealed on social media for the government to restore supplies.The crunch comes as global leaders prepare to attend a U.N. environmental conference by video link on Oct. 12-13 in the southwestern city of Kunming. That increases pressure on President Xi Jinping’s government to stick to emissions and energy efficiency targets.The ruling party also is preparing for the Winter Olympics in the Chinese capital, Beijing, and the nearby city of Shijiazhuang in February, a period when it will want clear blue skies.Scores of companies have announced power rationing could force them to delay filling orders and might hurt them financially.Apple components supplier Eson Precision Engineering Co. Ltd. said Sunday it would halt production at its factory in Kunshan, west of Shanghai, through Thursday “in line with the local government’s power restriction policy.”Eson said the suspension shouldn’t have a “significant impact” on operations.Apple didn’t immediately respond to a question about the possible impact on iPhone supplies.China’s energy consumption and industrial emissions have surged as manufacturers rush to fill foreign demand at a time when competitors elsewhere still are hampered by anti-coronavirus controls.China’s economy is “more driven by exports than any time in the past decade,” but official energy use targets fail to take that into account, economists Larry Hu and Xinyu Ji of Macquarie Group said in a report.Some provinces used up most of their official quotas for energy consumption in the first half of the year and are cutting back to stay under their limits, according to Li Shuo, a climate policy expert at Greenpeace in Beijing.Utility companies, meanwhile, are being squeezed by soaring coal and gas prices. That discourages them from increasing output because the government constrains their ability to pass on costs to customers, said Li.Prices have risen “past the range of what China’s electricity industry can bear,” Li said.China has launched repeated campaigns to make its energy-hungry economy more efficient and clean up smog-choked cities.City skies are visibly clearer, but the abrupt way the campaigns are carried out disrupts supplies of power, coal and gas, leaving families shivering in unheated homes and forcing factories to shut down.Shopping malls in the northeastern city of Harbin have announced they will close stores earlier than usual to save power.In Guangdong province in the south, the government told the public to set thermostats on air conditioners higher even as temperatures rose above 34 degrees C (93 degrees F).State Grid Corp., the world’s biggest power distributor, issued a pledge to ensure adequate supplies.Meanwhile, state media say local governments have signed long-term coal contracts to ensure adequate suppliers.;7
333;08/09/2017;How Hurricanes Harvey and Irma are affecting health care companies;"How Hurricanes Harvey and Irma are affecting health care companies. With Hurricane Irma and Hurricane Harvey hitting the U.S., the devastating storms are expected to and have affected health care companies with business in those parts of the country, from hospital chains to medical technology facilities and parts of the pharmaceutical supply chain. Hospital chains are chief among them, since hurricane activity can and has damaged hospital property, required patient relocation and disrupted care. With Hurricane Irma headed toward the Florida coast, the five hospital companies that appear to have the most Florida exposure are Tenet Healthcare Corporation THC, -1.78%, Surgery Partners Inc. SGRY, -2.83%, HCA Holdings Inc. HCA, -0.10%, Envision Healthcare US:EVHC and Community Health Systems CYH, -2.63%, according to Raymond James analyst John Ransom. Take Hurricane Matthew last October, which hit the Florida coast and eventually developed into a Category 5 hurricane; by contrast, Hurricane Irma is a Category 5 storm already. Hurricane Matthew affected companies in different ways. It cost Tenet hospitals an estimated $5 to $10 million and Tenet surgery centers an estimated $1.5 to $2 million, and cost Surgery Partners about $1.5 to $2 million, Ransom noted.Read: Harvey likely to have modest impact on HCA results: MizuhoCommunity Health Systems said that Hurricane Matthew had a negative impact but didnâ€™t specifically quantify it. HCA said the 2016 hurricane caused â€œminor disruptionâ€ but no major issues. For a company like MEDNAX Inc. MD, +0.56%, which provides physician services and for which Florida is one of its largest states, â€œthe bigger impact will likely come from office-based practices, which are more exposed to closures and/or rescheduling,â€ Ransom said. Related: U.S. stocks turn lower as investors wrestle with ECB, Hurricane IrmaA number of medical technology companies also have facilities in areas hit by or expected to be hit by Hurricane Irma, including C.R. Bard US:BCR, Boston Scientific Corp. BSX, -0.63%, Cantel Medical Corp. US:CMD , CONMED Corp. CNMD, -1.11%, Hill-Rom Holdings Inc. US:HRC, LivaNova LIVN, -1.15%, Medtronic MDT, +0.45%, Stryker Corp. SYK, -2.86% and Zimmer Biomet ZBH, +0.05%, according to Needham analyst Mike Matson. â€œWe estimate that the two storms (Harvey and Irma) could result in a procedural growth drag of ~30 bps for each week that hospitals are out of commission and/or patients are displaced,â€ Matson said. â€œWe believe this impact could last anywhere from 2-4 weeks, resulting in an estimated 60-120 bps drag on U.S. procedure growth in 3Q17.â€See more: Death toll rises to 10 as Hurricane Irma barrels through Caribbean, heads for FloridaPharmacies were also likely affected by Hurricane Harvey, noted UBS analyst Michael Cherny. CVS Health Corp. CVS, +1.48% has about 815 retail stores in Texas and 134 in Louisiana, and Walgreens Boots Alliance WBA, +1.92% has about 713 retail stores in Texas and 158 in Louisiana, he said. â€œThe stores located in the parts of TX and LA that were hit hardest by the storm could see material damage or even total collapse that will take time and effort to fully repair,â€ he said. â€œBesides the time to repair or rebuild stores, the communities hit by the storm will themselves take time to rebuild. Together, these factors will determine if/when these stores return to pre-storm traffic levels.â€The major stock indexes swung between gains and losses Thursday, in part because of hurricane fears. The Dow Jones Industrial Average DJIA, +0.28% was down 0.2% and the S&P 500 SPX, -0.06% was down 0.1%.";7
131;20/09/2021;Shell Offshore Facilities Damaged by Hurricane Ida, Will Remain Offline for 2021;"Shell Offshore Facilities Damaged by Hurricane Ida, Will Remain Offline for 2021. By Joe HoppeRoyal Dutch Shell PLC said Monday that Hurricane Ida caused significant structural damage to its West-Delta-143 offshore facilities in the Gulf of Mexico, which are set to remain offline for the rest of the year.The Anglo-Dutch energy company said that the WD-143 facilities--which it owns a 71.5% stake in, with the remainder owned by BP Exploration & Production Inc.--were damaged by the destructive Category 4 hurricane that raged from Aug. 26 to Sept. 4.The ""A"" platform facilities at WD-143 will be offline for repairs until the end of 2021, while the facilities on its ""C"" platform will be operational in the fourth quarter of the year. As such, it expects to resume production from its Olympus platform and Mars and Ursa facilities in the first quarter of 2022.Around this stage in the recovery, about 60% of Shell-operated production in the Gulf of Mexico is back online.The company said its top priority was the protection and recovery of its people, assets, the community and the environment.Shares at 1313 GMT were down 27.4 pence, or 1.9%, at 1428.6 pence.Write to Joe Hoppe at joseph.hoppe@wsj.com";7
34;29/11/2021;BP Plans Major Green Hydrogen Project in England;"BP Plans Major Green Hydrogen Project in England. By Jaime Llinares TaboadaBP PLC said Monday that it is planning a major green hydrogen project in Teesside, in the northeast of England.The HyGreen Teesside project could deliver up to 500 megawatts of electrical input of hydrogen production by 2030, the oil-and-gas company said. The facility is to be developed in multiple stages, and BP is aiming to start production by 2025 with an initial phase of around 60 megawatts.A final investment decision on the project is expected in 2023, BP said.HyGreen Teesside is in addition to BP's already-proposed H2Teesside blue hydrogen project. Blue hydrogen is produced using natural gas and capturing the emissions generated in the process, whereas green hydrogen uses renewable power.""Low-carbon ‎hydrogen will be essential in decarbonizing hard-to-abate industrial sectors including heavy transport. ‎Together, HyGreen and H2Teesside can help transform Teesside into the U.K's green heart, ‎strengthening its people, communities and businesses,"" Louise Jacobsen Plutt, BP's senior vice president for hydrogen and CCUS, said.HyGreen Teesside and H2Teesside together could deliver 30% of the U.K.'s target of developing 5 gigawatts of hydrogen production by 2030, BP said.Write to Jaime Llinares Taboada at jaime.llinares@wsj.com; @JaimeLlinaresT";7
797;13/07/2021;These 2 companies had more Emmy nominations than Netflix;These 2 companies had more Emmy nominations than Netflix. Netflix Inc. received an impressive 129 nominations for the 73rd annual Emmy Awards on Tuesday, but that was only good for third place among its rivals.A pair of multi-platform media giants — the Walt Disney Co. DIS, +0.90% and AT&T Inc.’s T, +1.20% WarnerMedia — took the top two spots, with Disney at 146 and Warner at 138, according to a tally by the Television Academy. Among individual platforms, Warner’s HBO/HBO Max had 130 nominations — one more than Netflix NFLX, -1.07%. Streaming services have come to dominate Emmy nominations in recent years, as companies spend billions of dollars on original content in a battle to lure subscribers in an intensely competitive streaming environment.Read more: ‘The Crown’ and ‘The Mandalorian’ get the most Emmy nominations as Netflix and other streaming services continue to dominateIn 2020, Netflix set a record with 160 Emmy nominations.This year, Disney ranked No. 1, with its Disney+ streaming service earning 71 nominations, while fellow streamer Hulu (which Disney controls) got 25, broadcast standby ABC earned 23 and cable’s FX Networks picked up 16.Among the other major media companies, Comcast Corp.’s CMCSA, -0.00 NBCUniversal got 56 nominations, ViacomCBS Inc. VIAC, +1.19% earned 54, Apple Inc. AAPL, -0.12% received 35 and Amazon.com Inc. AMZN, -1.10% snagged 18 for its Prime Video service.Here’s the full breakdown:The major Emmy winners will be named during an in-person ceremony hosted by Cedric the Entertainer on Sept. 19, and broadcast on CBS.;8
498;15/09/2021;Time’s ‘Most Influential’ list includes Tim Cook, Elon Musk and Naomi Osaka;Time’s ‘Most Influential’ list includes Tim Cook, Elon Musk and Naomi Osaka. Time released its annual list of the 100 Most Influential People featuring some of the world’s top business leaders, including Tesla’s TSLA, -1.79% Elon Musk and Apple CEO AAPL, -0.19% Tim Cook.Musk, who launched several projects between his companies Tesla and SpaceX, was in the news a lot in 2021. SpaceX was awarded a $2.9 billion NASA contract to bring astronauts to the moon, and is sending four civilians into Earth’s orbit on Wednesday as part of its latest launch.See also: Social media usage has been linked to mental health issues — here’s what TikTok, Facebook and Twitter are doing to helpThe blurbs for Time’s 100 Most Influential People were written by other leaders celebrities — Musk’s was written by Huffington Post founder Arianna Huffington.Tim Cook, who this week hosted Apple’s Fall event where he revealed the iPhone 13 lineup as well as a larger Apple Watch, was part of Time’s list once again.As the leader of one of the biggest companies in the world, Cook has spearheaded Apple’s explosive growth. Since he took over as CEO in 2011, Apple’s stock has jumped nearly 1,000%.Cook’s blurb was written by Nike NKE, +0.32% founder Phil Knight.Also part of the list was tennis star Naomi Osaka. In 2021, Osaka won the Australian Open and became the highest-paid female athletes in the world.Outside of her successful tennis career, Osaka has deals with Nike, Sweetgreen, Barbie and Nissan, among many others — Osaka also recently said that she is moving toward investing in cryptocurrency.See also: Over $20 billion is expected to be wagered on football in 2021, analyst saysOsaka has admitted to battling with mental health issues recently that have forced her out of some tournaments, even claiming, “It’s O.K. not to be O.K,“ offering support to others going through their own struggles. Her blurb was written by fellow tennis star Serena Williams.Tampa Bay Buccaneers quarterback Tom Brady, Olympic gymnast Sunisa Lee, and MLB star Shohei Ohtani all represented athletes on Time’s list.See also: California recall: Candidates, polls and what you need to knowPolitical figures like President Joe Biden, former President Donald Trump, Sen. Joe Manchin and Fox’s Tucker Carlson were also on the list under the “Leaders” section.;8
492;19/09/2021;2021 Emmy Awards: Streaming services sweep top honors for first time;2021 Emmy Awards: Streaming services sweep top honors for first time. LOS ANGELES — Netflix’s “The Crown” and “The Queen’s Gambit” combined with Apple TV+’s “Ted Lasso” to win top series honors at the Sunday’s Emmy Awards, a first for streaming services that cemented their rise to prominence in the television industry.“I’m at a loss for words,” said Peter Morgan, the creator and writer of the British royal saga “The Crown,” which collected acting, writing and directing awards in addition to four acting honors.His comment may also apply to the premium cable channels that once dominated the Emmy Awards and to the broadcast networks — including Sunday’s host, CBS — that have long grown accustomed to being largely also-rans.Read: 2021 Emmy Awards: Here are all the winnersThe ceremony also proved disappointing to those scrutinizing diversity in Hollywood. The record number of nominees of color yielded only only two Black winners, including RuPaul for “RuPaul’s Drag Race” and Michaela Coel for “I May Destroy You.”Netflix’s NFLX, -1.12% “The Crown” stars Olivia Colman and Josh O’Connor won the top drama acting honors Sunday, with Jason Sudeikis, star of Apple’s AAPL, -0.20% warm-hearted “Ted Lasso,” and Jean Smart of the generation-gap story “Hacks,” winners on the comedy side.Colman and O’Connor were a winning fictional mother-son duo: She plays Queen Elizabeth II, with O’Connor as Prince Charles in the British royal family saga that combines gravitas and soap opera.“I’d have put money on that not happening,” Colman said of the award, calling it “a lovely end to the most extraordinary journey” with the show’s cast and creators. She cut her remarks short, explaining why she was growing tearful.“I lost my daddy during COVID, and he would have loved all of this.” she said.O’Connor gave a shoutout to Emma Corwin, who played opposite him as Princess Diana and was also a nominee Sunday, as a “force of nature.”He also offered thanks to his grandparents, including his grandmother who died a few months ago, and his grandfather, Peter O’Connor, for the “greatest gifts” of kindness and loyalty.”Sudeikis, who also produces the series that many viewers found a balm for tough pandemic times, gave a speech that evoked the chipper, upbeat character he plays in the series about a U.K. soccer team and its unlikely American coach.“This show’s about families and mentors and teammates, and I wouldn’t be here without those things in my life,” said Sudeikis. He also thanked his fellow castmates, saying “I’m only as good as you guys make me look.”Smart, who received a standing ovation, began her acceptance speech on a somber note: Her husband actor, Richard Gilliland, died six months ago.“I would not be here without him” and his willingness to put her career first, said Smart. She also praised their two children as “courageous individuals in their own right.”Earlier in the evening, ebullient “Ted Lasso” castmate Hannah Waddingham, winner of the best supporting actress award for a comedy, said Sudeikis “changed my life with this, and more importantly my baby girl’s.”The show’s Brett Goldstein, who won the counterpart award for supporting actor, said he had promised not to swear and either mimed or was muted for a few seconds, then called the show the “privilege and pleasure” of his life.Gillian Anderson and Tobias Menzies of British royal drama “The Crown” were honored for their supporting performances.Anderson, who played British political leader Margaret Thatcher, used her acceptance speech to thank her manager of 20 years for her mentorship and believing in her talent before she did.Menzies who plays Prince Philip, didn’t attend the ceremony, which included a London gathering for “The Crown” nominees.Before announcing the winner in his category, presenter Kerry Washington saluted another nominee, Michael K. Williams of “Lovecraft County.” Williams died Sept. 6 at age 54.“Michael was a brilliantly talented actor and a generous human being who has left us far too soon,” Washington said.Another lost star was remembered by John Oliver of “Last Week Tonight with John Oliver.”“No one was funnier in the last 20 years than Norm Macdonald on late-night comedy,” Oliver said in accepting the Emmy for best variety talk show, suggesting people spend time checking out clips of Macdonald, as he did after Macdonald died Sept. 14 at age 61.Kate Winslet, who played the title character in “Mare of Easttown,” and Ewan McGregor, who starred in the fashion biopic “Halston,” were honored as top actors for a limited series.Winslet saluted her sister nominees in “this decade that has to be about women having each other’s back.”Julianne Nicholson and Evan Peters claimed best supporting acting honors for “Mare of Easttown,” about crime and family dysfunction.“The script was “true to the horror and beauty of ordinary people’s lives,” particularly the lives of women, said Nicholson.Both she and Peters saluted star Winslet.“Man, you’re good at acting. But turns out you’re good at caring for a whole production,” Nicholson said.Debbie Allen received the Governors Award for a long and acclaimed career as an actor, dancer, choreographer and activist“I am trembling with gratitude and grace and trying not to cry … it’s been many years in the making, taken a lot of courage to be the only woman in the room most of the time. Courage and creative and fight and faith to believe I could keep going, and I have,” she said.The show opened with a musical number that featured host Cedric the Entertainer rapping a modified version of the Biz Markie hip-hop hit “Just a Friend” with lyrics like “TV, you got what I need.” LL Cool J bounded from the audience as stars like Rita Wilson, Mandy Moore and more dropped verses celebrating the breadth of television.Seth Rogen presented the first award, throwing some cold water on the celebratory vibe by noting that the Emmys were being held in a giant tent. “There’s way too many of us in this little room,” he exclaimed in what seemed to be an attempt to be funny that fell flat.“Why is there a roof? It’s more important that we have three chandeliers than make sure we don’t kill Eugene Levy tonight. That is what has been decided.”Cedric the Entertainer worked hard and landed some laugh-getting jokes, but the night’s comedy bits were hit and miss — including Stephen Colbert’s jokes about California’s failed gubernatorial recall and Ken Jeong’s effort to get past security and into the show.Roughly 500 people attended the Emmys in downtown Los Angeles, with fashion standout Billy Porter sporting large wings attached to the sleeves of his black trouser look and Sudeikis walked the red carpet in a velvet suit of soft blue.The producers’ ultimate goal is a ceremony that is upbeat and acknowledges how much TV’s importance grew during the pandemic and its lockdowns.;8
143;01/12/2021;The Weeknd, H.E.R. and Olivia Rodrigo win honors at third annual Apple Music Awards;The Weeknd, H.E.R. and Olivia Rodrigo win honors at third annual Apple Music Awards. NEW YORK (AP) — Olivia Rodrigo, H.E.R. and The Weeknd have all won honors at a revamped Apple Music Awards, which has grown larger to encompass global music patterns.Rodrigo was named breakthrough artist of the year, her “Sour” was named best album of the year and her “drivers license” was song of the year.The streaming service crowned H.E.R. as songwriter of the year and The Weeknd was named global artist of the year, a step up from the category last year which was mere artist of the year.“I am very honored and blessed to receive this recognition,” H.E.R. said in a statement. “As a young Black and Filipino artist, and a woman who is on the stage giving my all, there’s no doubt that representation is important.”The Weeknd thanked Apple for the honor and being supportive “not only for my work but also for great music by newer artists where it matters so much for creators to be found and supported.”The Apple Music Awards, now in its third year, also introduced a new category of awards recognizing artists from five countries and regions — Africa, France, Germany, Japan, and Russia — who made the greatest impact culturally and on the charts in their respective countries and regions.The winners are Aya Nakamura for the French region, OFFICIAL HIGE DANDism for Japan, RIN for Germany, Scriptonite for Russia and Wizkid for Africa.“We’re thrilled to honor the artists that are shaping culture and connecting with fans around the world on Apple Music,” said Oliver Schusser, Apple’s vice president of Apple Music and Beats. “This year we’re also recognizing more regional artists, showing the world the impact of extraordinary talented musicians who are making waves globally.”The service said winners are chosen through a process that reflects both Apple Music’s editorial perspective and what customers around the world are listening to the most.Last year, rapper Lil Baby was named artist of the year by Apple, Taylor Swift was named songwriter of the year and Megan Thee Stallion was honored with breakthrough artist of the year.;8
